number,value,state,params_activation,params_batch_size,params_clip_grad_norm,params_dropout,params_hidden_dim_1,params_hidden_dim_2,params_hidden_dim_3,params_hidden_dim_4,params_hidden_dim_5,params_lr,params_n_layers,params_optimizer,params_scaler_type,params_use_batchnorm,params_weight_decay
0,0.38105101263184454,COMPLETE,relu,32,1.3188625250081478,0.15144949407566133,288,224,32.0,64.0,96.0,0.0017666964164926905,5,adam,robust,False,1.6141048036518404e-06
1,0.3906354911538673,COMPLETE,relu,128,2.09070438329151,0.3056079704072901,224,384,192.0,,,0.0004073579971527264,3,adamw,robust,False,0.0004275075510840848
2,0.39158937044518277,COMPLETE,leaky_relu,128,2.4989204548419788,0.17878956528535783,448,512,480.0,192.0,,0.00016081696407921773,4,adam,robust,False,4.663106804020776e-07
3,0.36978167097328407,COMPLETE,gelu,128,2.70265381171799,0.42139145359761115,192,192,288.0,32.0,160.0,0.0005389817357504753,5,adamw,robust,True,2.1587870611901468e-07
4,,FAIL,leaky_relu,64,4.30239424794086,0.4716394116678637,96,480,480.0,,,1.8728720841239093e-05,3,adamw,robust,True,3.4011764253422046e-05
5,0.39350144548090177,COMPLETE,relu,32,0.6276495024983375,0.040456551864980095,384,512,192.0,160.0,448.0,4.680077818280909e-05,5,adamw,standard,False,4.343712746093754e-06
6,0.374307469846481,PRUNED,relu,256,3.393955791661423,0.40437131735033105,320,128,,,,0.002331534553502882,2,adam,robust,True,2.7451064169439225e-07
7,0.3775867444414069,PRUNED,relu,64,2.789373382451584,0.16635203924111858,64,64,224.0,256.0,480.0,1.007245875218627e-05,5,adam,standard,False,6.891643110298046e-05
8,0.3763792222536541,PRUNED,relu,128,3.0607308861292717,0.4634294309125163,384,352,384.0,224.0,,7.147032156971482e-05,4,adam,robust,True,5.368548657967529e-07
9,0.36950563357445676,PRUNED,relu,256,1.548545014077264,0.2245874752147718,192,288,,,,8.000828471856373e-05,2,adam,robust,True,1.9623898505003515e-05
10,0.3547334700626109,PRUNED,leaky_relu,256,4.796776717293971,0.3874533882033411,224,288,416.0,128.0,448.0,0.00027439907109401423,5,adam,robust,False,1.4270763304267162e-07
11,0.3708511061409788,PRUNED,gelu,32,0.8150877415020534,0.005550137006911884,512,512,64.0,,,1.5892430188138028e-05,3,adamw,standard,False,6.1355686322250515e-06
12,0.3776394603706549,PRUNED,leaky_relu,32,4.145741474444134,0.011352174302653825,480,512,320.0,448.0,,5.4922270560249904e-05,4,adamw,standard,False,2.9211702376929784e-06
13,0.3528886265334547,PRUNED,leaky_relu,64,0.567455906687043,0.12275920556990724,416,416,480.0,192.0,,0.007771279445275827,4,adamw,standard,False,9.72136094853114e-07
14,0.3706865585469178,PRUNED,leaky_relu,128,1.978881556753538,0.08545775580724105,448,448,160.0,384.0,,3.3286829288856694e-05,4,adamw,standard,False,1.9972142075819572e-05
15,0.3941217673633283,COMPLETE,leaky_relu,32,3.8221418251072468,0.25737282781896126,352,480,128.0,,,0.00016127587660521436,3,adam,standard,False,6.586934409600648e-06
16,0.3710566252831934,PRUNED,gelu,32,4.024840937009628,0.31413816583886933,352,448,128.0,,,2.9036790236404286e-05,3,adamw,standard,False,9.710094290304552e-05
17,0.3849110357017094,PRUNED,leaky_relu,32,3.6627383590155524,0.28026539143453955,96,352,96.0,,,0.0001370145737408949,3,adamw,standard,False,5.922532728824902e-06
18,0.39278670773601976,COMPLETE,leaky_relu,32,4.8461559211270515,0.22948192180208848,352,448,,,,0.0010117277027175365,2,adam,standard,False,4.747156357879507e-05
19,0.37574377999985675,PRUNED,relu,32,4.180734904127759,0.06642572882403583,288,320,224.0,,,0.0001711800219505741,3,adam,standard,True,0.0008527674875179516
20,0.3775537334947466,PRUNED,gelu,32,1.0630001130939393,0.3499518916778899,384,480,,,,3.0875105312024324e-05,2,adamw,standard,False,2.3832680722217447e-06
21,0.3963765090422494,COMPLETE,relu,64,1.8286187264221057,0.21313271749821694,128,384,128.0,320.0,320.0,0.0007545084972432487,5,adam,standard,False,1.548191629396424e-05
22,0.3772740051446568,PRUNED,relu,64,1.833649649527986,0.2520495652340191,32,416,128.0,352.0,320.0,0.0007549129950441475,5,adam,standard,False,1.520762716409577e-05
23,0.3954787133760186,PRUNED,relu,64,2.325197967740597,0.05565910561851767,128,384,192.0,320.0,320.0,0.00024889293690150285,5,adam,standard,False,6.48546970429337e-06
24,0.36497783122538796,PRUNED,relu,64,1.1546110797003324,0.19478342680998068,128,480,96.0,512.0,,0.005014773921683913,4,adam,standard,False,4.303710638615842e-05
25,0.3762307211896927,PRUNED,relu,64,3.13425323284367,0.12256629523759743,256,416,256.0,128.0,384.0,0.0012905520115742864,5,adam,standard,False,0.00020623482454898312
26,0.36564534770310997,PRUNED,leaky_relu,32,0.5059981845129001,0.4981740316533589,320,480,32.0,288.0,,0.00010449250713536344,4,adam,standard,False,3.845516615449807e-06
27,0.3635024611469674,PRUNED,relu,32,1.5637521849134242,0.3460404371369176,416,352,160.0,,,4.759924052635197e-05,3,adamw,standard,True,1.2461823328327322e-05
28,0.387362313087455,PRUNED,relu,64,4.487649474872235,0.25919698148609477,160,448,96.0,416.0,224.0,0.00037218417690341207,5,adam,standard,False,2.311568295320925e-05
29,0.37549148976712243,PRUNED,gelu,256,3.5372862616738683,0.20798090631452384,352,224,320.0,128.0,,0.0030636491888469397,4,adamw,standard,False,7.362613899481064e-06
30,0.39411263463281615,COMPLETE,leaky_relu,32,1.5886065067293111,0.12290832959150125,256,224,160.0,288.0,512.0,0.0007776998297928173,5,adam,standard,False,1.465178653359858e-06
31,0.3785294501944323,PRUNED,leaky_relu,32,1.4607926168822818,0.13887559877396702,256,224,128.0,288.0,32.0,0.0006985396612381448,5,adam,standard,False,1.1758862976073662e-06
32,0.37620489331827767,PRUNED,leaky_relu,32,0.8864243033538421,0.07241079180829921,320,256,192.0,224.0,512.0,0.0013823775401379797,5,adam,standard,False,2.121543003406265e-06
33,0.39507814679837616,PRUNED,leaky_relu,32,1.7821443330284268,0.09829942302444279,288,128,160.0,352.0,416.0,0.00025646548579490776,5,adam,standard,False,9.603851456916271e-07
34,0.38664942380709816,PRUNED,leaky_relu,32,2.2487965666950225,0.025991366054058808,224,160,224.0,320.0,512.0,0.00040577026427740986,5,adam,standard,False,3.885198817487399e-06
35,0.3707515879317697,PRUNED,relu,32,1.3483142229502865,0.16143925292818628,384,512,32.0,160.0,384.0,0.0005302654511013511,5,adam,standard,False,1.5188127239522235e-06
36,0.3956595054935444,PRUNED,leaky_relu,128,2.423147985385678,0.2912397586897326,448,384,64.0,,,0.0021781246434180606,3,adam,robust,False,1.079140212455221e-05
37,0.3684666417626483,PRUNED,relu,64,2.7530543523806563,0.18705384282761517,32,32,160.0,256.0,288.0,0.00016193478073866954,5,adamw,standard,True,5.412568564719592e-07
38,0.39127085565759284,COMPLETE,leaky_relu,32,2.0878106106360557,0.04273279907983832,192,192,192.0,64.0,,0.0009001561309853979,4,adam,robust,False,3.50665940658488e-05
39,0.3714671315266339,PRUNED,relu,256,1.709620786801972,0.11320757706352735,416,256,256.0,448.0,,0.0005899985661936781,4,adam,standard,True,0.00010317259297176901
40,0.3769848423576807,PRUNED,relu,128,1.1622398764549564,0.1471215012860887,96,320,128.0,224.0,448.0,1.9393415651803306e-05,5,adam,robust,False,4.853656389958632e-07
41,0.38286890615861124,PRUNED,gelu,32,3.0873269387876876,0.23027004492038827,288,480,64.0,,,9.112615516846493e-05,3,adamw,standard,False,4.186769871511586e-06
42,0.37483431916556154,PRUNED,leaky_relu,32,4.979451373416375,0.23111941572470251,352,448,,,,0.0011166200547049793,2,adam,standard,False,3.4848171981710234e-05
43,0.38831617634131305,PRUNED,leaky_relu,32,4.598701411120025,0.32006623221890185,352,512,,,,0.0033767822137414217,2,adam,standard,False,5.745759979199968e-05
44,0.39496713871666417,PRUNED,leaky_relu,32,3.85782497098672,0.26742838811630204,384,416,,,,0.0018061765106585595,2,adam,standard,False,9.517370119657454e-06
45,0.3907977192143175,COMPLETE,leaky_relu,32,2.627304321298181,0.21340974466085222,320,480,,,,0.00097761589908824,2,adam,standard,False,0.000291575464464654
46,0.36841299299201735,PRUNED,leaky_relu,256,0.765875159441078,0.17727441570978705,480,512,,,,0.0004695898229610704,2,adam,standard,False,2.1307000902312304e-05
47,0.37221884101279523,PRUNED,leaky_relu,64,4.5708805058184705,0.23654956343587524,256,448,288.0,,,0.00031799048703708507,3,adam,robust,True,8.766784382345652e-05
48,0.37579274482254976,PRUNED,relu,32,3.2227158340116406,0.03220437202590419,192,320,192.0,320.0,352.0,0.0015638883557597028,5,adamw,standard,False,1.8464947686850846e-06
49,0.3814182093040567,PRUNED,leaky_relu,128,2.9307781642864987,0.09488312700337956,416,384,224.0,,,5.3840213761226445e-05,3,adam,standard,False,0.00014516369743738526
50,0.3776033618118684,PRUNED,gelu,32,4.296355614199278,0.3308559674748399,352,128,96.0,96.0,,0.00020765775031436894,4,adamw,standard,False,2.718623607996099e-07
51,0.37392980659250735,PRUNED,leaky_relu,32,3.8168436731953825,0.19815526790643945,160,480,512.0,192.0,256.0,1.0021689812657703e-05,5,adam,robust,False,2.936456829318062e-06
52,0.3823186879650994,PRUNED,leaky_relu,128,1.9193743913704453,0.1687314130489282,512,512,416.0,192.0,,0.00011377963732553448,4,adam,robust,False,5.422318742206154e-07
53,0.3779203492850991,PRUNED,leaky_relu,128,2.6081182605572772,0.13975652360014015,448,448,384.0,160.0,512.0,0.0007197242035684188,5,adam,robust,False,1.0376757461933875e-07
54,0.37760498171131496,PRUNED,leaky_relu,128,2.4633843757462692,0.2905737284757865,480,480,320.0,256.0,,0.00019351960360894342,4,adam,robust,False,7.422347888871165e-07
55,0.38819927251064956,PRUNED,relu,64,2.152640166981919,0.24225574807962308,384,416,480.0,,,0.00013995606591105434,3,adam,robust,False,4.8882918325588e-06
56,0.36293371810654573,PRUNED,leaky_relu,128,3.3619140149482867,0.2095338268388767,448,512,128.0,32.0,416.0,4.151146921049692e-05,5,adamw,standard,True,2.0385645635899192e-07
57,0.3820536255130441,PRUNED,relu,32,2.9184236147604934,0.1829294426724027,320,416,352.0,224.0,192.0,7.378645977895876e-05,5,adam,standard,False,8.67991725966064e-06
58,0.39369924881283186,PRUNED,leaky_relu,64,0.7383754138726986,0.0012747265670780689,416,480,160.0,288.0,,0.00035763182564492604,4,adam,standard,False,1.5749331264658663e-05
59,0.37208763433331327,PRUNED,gelu,256,1.5917181942486471,0.2626531647406955,480,192,,,,0.0008783473795012452,2,adamw,robust,False,3.557702782085972e-07
60,0.3718185821000274,PRUNED,relu,32,1.019469321138632,0.11488517119852999,64,288,256.0,160.0,448.0,1.3931714880082613e-05,5,adam,standard,False,2.7625695534460583e-05
61,0.3799451456493815,PRUNED,leaky_relu,128,2.040275195481551,0.15694661285330444,288,448,448.0,352.0,,2.3093566184478052e-05,4,adam,standard,False,2.796684485662235e-06
62,0.39038618811034204,PRUNED,leaky_relu,32,2.0512683708296002,0.036235588841589145,192,192,192.0,64.0,,0.001089495827291158,4,adam,robust,False,4.102067083118645e-05
63,0.3883585056994114,PRUNED,leaky_relu,32,2.216703145496105,0.05069196683063559,160,192,192.0,64.0,,0.0006089054075467607,4,adam,robust,False,1.6473199526835375e-05
64,0.3721916660188168,PRUNED,leaky_relu,32,1.344302893130817,0.07045464585497686,224,224,128.0,96.0,,0.000834829697868386,4,adam,robust,False,2.9601072450519217e-05
65,0.3810277443252304,PRUNED,leaky_relu,32,2.4099729293507814,0.0886149966382114,192,96,224.0,,,0.0004451999009429734,3,adam,robust,False,5.888809908497247e-05
66,0.382109562769129,PRUNED,leaky_relu,32,1.6928813118846626,0.04968794562695624,128,160,160.0,32.0,352.0,0.002194996755098881,5,adam,robust,False,1.3658803413482011e-06
67,0.37838841659204026,PRUNED,relu,64,1.8763044728901404,0.01683139723461305,224,256,96.0,96.0,,0.0002874338837344217,4,adamw,standard,True,5.355012989147985e-06
68,0.37694059195087737,PRUNED,leaky_relu,32,4.781699093797031,0.1299302936955793,256,160,192.0,384.0,480.0,6.225973008932317e-05,5,adam,robust,False,8.781286180814206e-07
69,0.37813493050508334,PRUNED,relu,32,0.6284705177992117,0.22229387470315037,96,512,288.0,,,0.0028226030420586963,3,adam,standard,False,4.1701388075571135e-05
70,0.37700307010294876,PRUNED,leaky_relu,64,4.296111614233669,0.27900397865567444,384,224,96.0,128.0,,0.0014415968425226526,4,adam,standard,False,1.361847461138125e-05
71,0.3821354188900944,PRUNED,gelu,32,1.1986934852407465,0.19964480733239376,320,384,160.0,192.0,384.0,0.0006297483809802204,5,adamw,standard,False,6.731809834539094e-06
72,0.39604684864137774,COMPLETE,leaky_relu,32,2.5983769240365127,0.21793213397989541,320,480,,,,0.0009237980454434094,2,adam,standard,False,0.00018487594194121424
73,0.37750239637423516,PRUNED,leaky_relu,32,2.5312896531338445,0.2489754984938456,352,480,,,,0.0011948057974365198,2,adam,standard,False,0.0004003398244331653
74,0.39750490758156753,COMPLETE,leaky_relu,32,2.32356923645467,0.38602540514996175,320,352,,,,0.0017426803787583814,2,adam,standard,False,0.00018073848892979683
75,0.3771919832041717,PRUNED,leaky_relu,32,2.308112946592422,0.43570614379761696,320,352,,,,0.004915388393130775,2,adam,standard,False,0.0007865144723692343
76,0.38089482048892437,PRUNED,leaky_relu,32,2.8604873250650216,0.41635404768035883,352,448,,,,0.001804094294177054,2,adam,standard,False,0.0002216272031455456
77,0.3789033886356554,PRUNED,relu,256,2.7301866146457496,0.17339220518310428,320,352,,,,0.00023168598539385305,2,adam,standard,False,0.0003365915223998872
78,0.3756001710264429,PRUNED,leaky_relu,32,3.484952831275201,0.18930882931477053,384,512,,,,0.00011750018435642158,2,adam,standard,False,0.00019161824408732146
79,0.3780274112736419,PRUNED,leaky_relu,32,1.492509720629551,0.37655883032156934,288,416,,,,0.003945197821176142,2,adam,standard,True,0.0007092249224663245
80,0.3766453579840087,PRUNED,relu,128,2.291561765840779,0.4724588738354913,352,480,,,,0.0005042258475688927,2,adamw,standard,False,0.0001744319311979598
81,0.389220717090806,PRUNED,leaky_relu,64,3.016269686357736,0.3872421016124232,416,320,,,,0.002423552656217252,2,adam,standard,False,0.00015351856390302587
82,0.3956046327792457,PRUNED,leaky_relu,32,2.1458655836947145,0.10818954615350158,256,448,,,,0.0009687697210480854,2,adam,standard,False,0.00011089760808589707
83,0.3750890604441842,PRUNED,leaky_relu,32,1.7798943473563176,0.2266041520341979,320,512,224.0,,,0.0007729674093220727,3,adam,standard,False,8.641512188351979e-06
84,0.3522333979141079,PRUNED,leaky_relu,32,2.6320182726994354,0.30382339407239944,352,480,64.0,320.0,288.0,0.0016687182749595166,5,adam,standard,False,0.0005765838582783581
85,0.3902335141096774,PRUNED,leaky_relu,32,2.4932444799997944,0.2130001492285303,288,256,,,,0.001166016699404803,2,adam,standard,False,8.04112970038812e-05
86,0.37438557064351635,PRUNED,leaky_relu,32,3.9972809201416672,0.07560130722725147,160,384,128.0,,,0.0009533561717408979,3,adam,robust,False,5.3537130511721445e-05
87,0.3903866167161274,PRUNED,leaky_relu,32,1.951230719245138,0.15066380552202138,384,288,32.0,224.0,480.0,9.010812522147829e-05,5,adam,standard,False,0.00012608396382185873
88,0.3786887885164243,PRUNED,relu,128,2.0534575676713063,0.3590373774787189,256,480,,,,0.0006650983561345509,2,adam,standard,False,1.1891460277952393e-05
89,0.37954045114599566,PRUNED,gelu,32,2.3827882728696426,0.24979148874930135,320,416,256.0,288.0,96.0,0.00016514189130399434,5,adamw,robust,False,2.1868616860372184e-05
90,0.38079800991621854,PRUNED,leaky_relu,256,3.24050895980884,0.05970280944755743,224,512,160.0,256.0,,0.0003307482872263998,4,adam,standard,False,3.274501820369447e-06
91,0.38160313092558124,PRUNED,leaky_relu,32,1.647877773964173,0.19975787647470408,64,224,224.0,,,0.008313769757192243,3,adam,standard,True,2.334103322114199e-06
92,0.378926241361353,PRUNED,leaky_relu,32,2.6261238285951003,0.23899473517928493,320,480,,,,0.0010085194160231183,2,adam,standard,False,0.00034285942649972106
93,0.3819797064559488,PRUNED,leaky_relu,32,2.537715456828253,0.21507127400385137,288,512,,,,0.00054017311747305,2,adam,standard,False,0.00026779746434061095
94,0.3953310241082962,COMPLETE,leaky_relu,32,2.715699963477034,0.27417656781055,352,448,,,,0.00137962214175211,2,adam,standard,False,6.813418833956365e-07
95,0.3957270460105444,PRUNED,leaky_relu,32,2.7509673910135595,0.2872597698232926,352,448,,,,0.001415822225423092,2,adam,standard,False,4.51839769687314e-07
96,0.39671076560599816,PRUNED,leaky_relu,64,2.8859620001332953,0.2642389899900063,352,416,,,,0.000833681092987561,2,adam,standard,False,1.2410130236675418e-06
97,0.37684969596563717,PRUNED,relu,32,1.8253773638206754,0.27791801096111113,416,448,,,,0.0004054041483866538,2,adam,robust,False,7.912244507153385e-07
98,0.3599898976884153,PRUNED,leaky_relu,32,2.223413282794298,0.03898643406138075,512,448,128.0,384.0,416.0,0.001341152348334658,5,adam,standard,False,7.061791877590477e-07
99,0.38191270045019754,PRUNED,leaky_relu,128,3.6718162415468196,0.019003263199414117,128,480,288.0,160.0,224.0,4.258058588208411e-05,5,adamw,standard,False,1.7034434801644051e-06
100,0.3877668916945196,PRUNED,relu,32,2.814028602346204,0.30993266134124875,384,320,,,,0.001963406067972836,2,adam,robust,False,2.5725920185659815e-07
101,0.3816087949481807,PRUNED,leaky_relu,32,0.9626424564545539,0.22394380545931888,448,160,192.0,416.0,,0.00160399110099038,4,adam,standard,False,4.0012002278227446e-07
102,0.39676713418806986,COMPLETE,leaky_relu,32,2.994243831179836,0.18284938902361939,320,480,,,,0.0007168454034031972,2,adam,standard,False,0.0002696876595558543
103,0.3876391996545141,PRUNED,leaky_relu,32,2.1420864157326394,0.16368065897187908,320,192,,,,0.000722038078567639,2,adam,standard,False,0.0002346621851413577
104,0.37375902259182847,PRUNED,leaky_relu,32,4.983297744694803,0.1783933384146173,352,480,,,,0.0012113936994807362,2,adam,standard,False,6.114761069299524e-07
105,0.3792428924612906,PRUNED,leaky_relu,32,2.3842201606355955,0.1409332442950338,192,512,,,,0.0008357467068049016,2,adam,standard,False,2.548276979105168e-05
106,0.39690355567723196,PRUNED,leaky_relu,64,1.4452738957123845,0.1915658893553053,320,448,,,,0.0005646731305542288,2,adam,standard,False,0.0005013854048010099
107,0.38080740945705116,PRUNED,leaky_relu,32,3.0430344008639887,0.25710126660023513,288,480,,,,0.0019591166709021245,2,adam,standard,False,6.960214516633921e-05
108,0.3807986627087797,PRUNED,gelu,32,1.9958587645097372,0.3244447436538814,352,512,352.0,96.0,128.0,0.00044665022318161955,5,adam,standard,False,1.8678636540516572e-05
109,0.37909054216550664,PRUNED,leaky_relu,128,3.1898240209103688,0.20350304827696625,96,384,512.0,192.0,,0.0026076777988266174,4,adamw,robust,True,3.178872823093133e-05
110,0.3787825676032553,PRUNED,relu,32,4.379960460182632,0.2714261308913831,384,352,,,,0.0010883149378423905,2,adam,standard,False,7.578811708250992e-06
111,0.39971221814013685,COMPLETE,leaky_relu,256,4.722953066581359,0.23407998334182856,320,416,64.0,,,0.0006616656146685684,3,adam,standard,False,4.997260609659005e-06
112,0.37134721940096843,PRUNED,leaky_relu,256,4.73573140387814,0.24375786619809017,320,416,64.0,,,0.0006238455227217054,3,adam,standard,False,5.405940786720841e-06
113,0.37923812451774774,PRUNED,leaky_relu,256,4.871424683439611,0.23568093448255176,288,416,96.0,,,0.0008862251221700822,3,adam,standard,False,3.46825168145876e-06
114,0.37493145702698816,PRUNED,leaky_relu,256,4.699859850032594,0.21771437755325895,384,448,32.0,,,0.0007579563777057031,3,adam,standard,False,1.9561253395206685e-06
115,0.3911554031122377,PRUNED,leaky_relu,256,4.878097419110574,0.18147128848583824,352,416,128.0,,,0.00013801969261448334,3,adam,standard,False,1.7126168027427493e-07
116,0.37781315972467555,PRUNED,leaky_relu,256,4.506356555362119,0.20633531453990392,320,448,192.0,352.0,480.0,0.0013072356397812923,5,adam,standard,False,1.0098878297717486e-05
117,0.38396289880706697,PRUNED,leaky_relu,32,4.135720343113488,0.25501651090593447,352,384,,,,0.0005009258302560908,2,adam,standard,False,4.829532367083597e-06
118,0.37689511570274226,PRUNED,leaky_relu,64,2.652930521636478,0.08009714546285523,288,192,96.0,,,0.0006762381593174027,3,adam,robust,False,1.0787253930527996e-06
119,0.3834793030311904,PRUNED,relu,32,3.7793334128346237,0.16993979975686763,256,480,160.0,288.0,,2.6628971549272182e-05,4,adamw,standard,False,4.591151909606133e-06
120,0.39989535205887217,COMPLETE,leaky_relu,32,2.3150102103823738,0.2992283616305302,320,480,,,,0.0010680049554246888,2,adam,standard,False,0.00012517319970946182
121,0.38866815800629606,PRUNED,leaky_relu,32,4.587022064247705,0.4423734577670494,320,480,,,,0.00027578264885328525,2,adam,standard,False,0.00011670432981924063
122,0.384008219844295,PRUNED,leaky_relu,32,2.5125648464861627,0.33810438516835134,352,512,,,,0.0010376803672552566,2,adam,standard,False,0.00015755826071181525
123,0.3751712600979059,PRUNED,leaky_relu,32,2.3079082539400897,0.3036478747167787,320,480,,,,0.00154432657123785,2,adam,standard,False,6.480054085192105e-06
124,0.38496319508691706,PRUNED,leaky_relu,32,2.1972809079695033,0.22975530087812968,288,448,,,,0.0008722368776674195,2,adam,standard,False,8.341270139994445e-05
